{
  "task_id": "TASK-5",
  "slug": "fuzzy-and-emit",
  "stage": "done",
  "stage_history": [
    {"stage": "coding",    "agent": "python-developer", "started": "2026-04-13T02:31Z", "ended": "2026-04-13T03:00Z", "result": "ok"},
    {"stage": "migrating", "agent": "python-migrator",  "started": "2026-04-13T03:00Z", "ended": "2026-04-13T03:01Z", "result": "skipped"},
    {"stage": "reviewing", "agent": "python-reviewer",  "started": "2026-04-13T03:01Z", "ended": "2026-04-13T03:05Z", "result": "ok"},
    {"stage": "testing",   "agent": "python-tester",    "started": "2026-04-13T03:05Z", "ended": "2026-04-13T03:10Z", "result": "ok"},
    {"stage": "merging",   "agent": null,               "started": "2026-04-13T03:10Z", "ended": "2026-04-13T03:11Z", "result": "ok"}
  ],
  "fix_iterations": {"review": 0, "test": 0},
  "branch": "feature/TASK-5-fuzzy-and-emit",
  "pr": "merged",
  "depends_on": ["TASK-4"],
  "security_hints": [],
  "blockers": []
}
