{
  "task_id": "TASK-4",
  "slug": "anthropic-provider",
  "stage": "pending",
  "stage_history": [],
  "fix_iterations": {"review": 0, "test": 0},
  "branch": null,
  "pr": null,
  "depends_on": ["TASK-3"],
  "security_hints": ["ANTHROPIC_API_KEY must never be logged or included in ChatResponse.raw"],
  "blockers": []
}
