{
  "task_id": "TASK-4",
  "slug": "normalize-and-validate",
  "stage": "done",
  "stage_history": [
    {"stage": "coding",    "agent": "python-developer", "started": "2026-04-13T01:51Z", "ended": "2026-04-13T02:20Z", "result": "ok"},
    {"stage": "migrating", "agent": "python-migrator",  "started": "2026-04-13T02:20Z", "ended": "2026-04-13T02:21Z", "result": "skipped"},
    {"stage": "reviewing", "agent": "python-reviewer",  "started": "2026-04-13T02:21Z", "ended": "2026-04-13T02:25Z", "result": "ok"},
    {"stage": "testing",   "agent": "python-tester",    "started": "2026-04-13T02:25Z", "ended": "2026-04-13T02:30Z", "result": "ok"},
    {"stage": "merging",   "agent": null,               "started": "2026-04-13T02:30Z", "ended": "2026-04-13T02:31Z", "result": "ok"}
  ],
  "fix_iterations": {"review": 0, "test": 0},
  "branch": "feature/TASK-4-normalize-and-validate",
  "pr": "merged",
  "depends_on": ["TASK-3"],
  "security_hints": [],
  "blockers": []
}
